{
  "schema": "nuvanx-publication-manifest",
  "version": "1.0.0",
  "generated_at": "2026-08-15T21:45:00Z",
  "source": "https://nuvanx.com/",
  "routes": {
    "/": {"post_id":9,"post_type":"page","slug":"inicio","status":"publish","robots":{"index":true,"follow":true}},
    "/aviso-legal/": {"post_id":20,"post_type":"page","slug":"aviso-legal","status":"publish","robots":{"index":true,"follow":true}},
    "/bioestimuladores-colageno-madrid/": {"post_id":3321,"post_type":"page","slug":"bioestimuladores-colageno-madrid","status":"publish","robots":{"index":true,"follow":true}},
    "/blog/": {"post_id":16,"post_type":"page","slug":"blog","status":"publish","robots":{"index":true,"follow":true}},
    "/botox-madrid-precio-neuromoduladores/": {"post_id":3510,"post_type":"post","slug":"botox-madrid-precio-neuromoduladores","status":"publish","robots":{"index":true,"follow":true},"schema":{"group":"blog","type":"none","context":"https://schema.org"}},
    "/btl-exilite-ipl-madrid/": {"post_id":3055,"post_type":"page","slug":"btl-exilite-ipl-madrid","status":"publish","robots":{"index":true,"follow":true}},
    "/calidad-piel-firmeza-luminosidad-madrid/": {"post_id":3373,"post_type":"page","slug":"calidad-piel-firmeza-luminosidad-madrid","status":"publish","robots":{"index":true,"follow":true}},
    "/casos-de-pacientes/": {"post_id":2645,"post_type":"page","slug":"casos-de-pacientes","status":"publish","robots":{"index":true,"follow":true}},
    "/cicatrices-acne-poros-textura-madrid/": {"post_id":3374,"post_type":"page","slug":"cicatrices-acne-poros-textura-madrid","status":"publish","robots":{"index":true,"follow":true}},
    "/clinicas-de-medicina-estetica-nuvanx/": {"post_id":1399,"post_type":"page","slug":"clinicas-de-medicina-estetica-nuvanx","status":"publish","robots":{"index":true,"follow":true}},
    "/clinicas-de-medicina-estetica-nuvanx/medicina-estetica-goya-barrio-salamanca/": {"post_id":1537,"post_type":"page","slug":"medicina-estetica-goya-barrio-salamanca","status":"publish","robots":{"index":true,"follow":true}},
    "/contacto/": {"post_id":14,"post_type":"page","slug":"contacto","status":"publish","robots":{"index":true,"follow":true}},
    "/contorno-corporal-masculino-madrid/": {"post_id":3381,"post_type":"page","slug":"contorno-corporal-masculino-madrid","status":"publish","robots":{"index":true,"follow":true}},
    "/emfusion/": {"post_id":3487,"post_type":"page","slug":"emfusion","status":"publish","robots":{"index":true,"follow":true}},
    "/endolaser-corporal-grasa-localizada/": {"post_id":1200,"post_type":"page","slug":"endolaser-corporal-grasa-localizada","status":"publish","robots":{"index":true,"follow":true}},
    "/endolaser-corporal-vs-no-invasivos-grasa-localizada/": {"post_id":3330,"post_type":"post","slug":"endolaser-corporal-vs-no-invasivos-grasa-localizada","status":"publish","robots":{"index":true,"follow":true},"schema":{"group":"blog","type":"none","context":"https://schema.org"}},
    "/endolift-ciencia-laser-subdermico/": {"post_id":1591,"post_type":"post","slug":"endolift-ciencia-laser-subdermico","status":"publish","robots":{"index":true,"follow":true},"schema":{"group":"blog","type":"none","context":"https://schema.org"}},
    "/endolift-facial-papada-mandibula/": {"post_id":1241,"post_type":"page","slug":"endolift-facial-papada-mandibula","status":"publish","robots":{"index":true,"follow":true}},
    "/endolift-primeras-72-horas-que-esperar/": {"post_id":1593,"post_type":"post","slug":"endolift-primeras-72-horas-que-esperar","status":"publish","robots":{"index":true,"follow":true},"schema":{"group":"blog","type":"none","context":"https://schema.org"}},
    "/endolift-vs-hifu-diferencias-reales/": {"post_id":3326,"post_type":"post","slug":"endolift-vs-hifu-diferencias-reales","status":"publish","robots":{"index":true,"follow":true},"schema":{"group":"blog","type":"none","context":"https://schema.org"}},
    "/endolift-vs-lifting-quirurgico-cuando-operarse/": {"post_id":2821,"post_type":"post","slug":"endolift-vs-lifting-quirurgico-cuando-operarse","status":"publish","robots":{"index":true,"follow":true},"schema":{"group":"blog","type":"none","context":"https://schema.org"}},
    "/equipo-medico/": {"post_id":1575,"post_type":"page","slug":"equipo-medico","status":"publish","robots":{"index":true,"follow":true}},
    "/estetica-avanzada/": {"post_id":1415,"post_type":"page","slug":"estetica-avanzada","status":"publish","robots":{"index":true,"follow":true}},
    "/exion-body/": {"post_id":3486,"post_type":"page","slug":"exion-body","status":"publish","robots":{"index":true,"follow":true}},
    "/exion-btl-fractional-rf-face-body/": {"post_id":2907,"post_type":"post","slug":"exion-btl-fractional-rf-face-body","status":"publish","robots":{"index":true,"follow":true},"schema":{"group":"blog","type":"none","context":"https://schema.org"}},
    "/exion-btl/": {"post_id":2906,"post_type":"page","slug":"exion-btl","status":"publish","robots":{"index":true,"follow":true}},
    "/exion-face/": {"post_id":3466,"post_type":"page","slug":"exion-face","status":"publish","robots":{"index":true,"follow":true}},
    "/exion-fractional-rf-vs-morpheus8-comparativa/": {"post_id":3328,"post_type":"post","slug":"exion-fractional-rf-vs-morpheus8-comparativa","status":"publish","robots":{"index":true,"follow":true},"schema":{"group":"blog","type":"none","context":"https://schema.org"}},
    "/exion-fractional/": {"post_id":3411,"post_type":"page","slug":"exion-fractional","status":"publish","robots":{"index":true,"follow":true}},
    "/exposoma-cutaneo-envejecimiento-piel-factores-externos/": {"post_id":3314,"post_type":"post","slug":"exposoma-cutaneo-envejecimiento-piel-factores-externos","status":"publish","robots":{"index":true,"follow":true},"schema":{"group":"blog","type":"none","context":"https://schema.org"}},
    "/flacidez-grasa-localizada-brazos-madrid/": {"post_id":3377,"post_type":"page","slug":"flacidez-grasa-localizada-brazos-madrid","status":"publish","robots":{"index":true,"follow":true}},
    "/flacidez-muslos-internos-subgluteo-madrid/": {"post_id":3379,"post_type":"page","slug":"flacidez-muslos-internos-subgluteo-madrid","status":"publish","robots":{"index":true,"follow":true}},
    "/gracias/": {"post_id":78,"post_type":"page","slug":"gracias","status":"publish","robots":{"index":true,"follow":true}},
    "/grasa-espalda-zona-sujetador-madrid/": {"post_id":3378,"post_type":"page","slug":"grasa-espalda-zona-sujetador-madrid","status":"publish","robots":{"index":true,"follow":true}},
    "/grasa-localizada-abdomen-flancos-madrid/": {"post_id":3376,"post_type":"page","slug":"grasa-localizada-abdomen-flancos-madrid","status":"publish","robots":{"index":true,"follow":true}},
    "/intrusismo-tratamientos-inyectables-riesgos/": {"post_id":2820,"post_type":"post","slug":"intrusismo-tratamientos-inyectables-riesgos","status":"publish","robots":{"index":true,"follow":true},"schema":{"group":"blog","type":"none","context":"https://schema.org"}},
    "/inversion-medicina-estetica/": {"post_id":3367,"post_type":"page","slug":"inversion-medicina-estetica","status":"publish","robots":{"index":true,"follow":true}},
    "/ipl-medica-btl-exilite-manchas-rojeces-acne-fotorejuvenecimiento/": {"post_id":3056,"post_type":"post","slug":"ipl-medica-btl-exilite-manchas-rojeces-acne-fotorejuvenecimiento","status":"publish","robots":{"index":true,"follow":true},"schema":{"group":"blog","type":"none","context":"https://schema.org"}},
    "/labios-acido-hialuronico-madrid/": {"post_id":3318,"post_type":"page","slug":"labios-acido-hialuronico-madrid","status":"publish","robots":{"index":true,"follow":true}},
    "/laser-co2-fraccionado-madrid-textura-cicatrices-poro/": {"post_id":2017,"post_type":"page","slug":"laser-co2-fraccionado-madrid-textura-cicatrices-poro","status":"publish","robots":{"index":true,"follow":true}},
    "/laser-co2-vs-radiofrecuencia-cuando-elegir/": {"post_id":3308,"post_type":"post","slug":"laser-co2-vs-radiofrecuencia-cuando-elegir","status":"publish","robots":{"index":true,"follow":true},"schema":{"group":"blog","type":"none","context":"https://schema.org"}},
    "/madrid/": {"post_id":2635,"post_type":"page","slug":"madrid","status":"publish","robots":{"index":true,"follow":true}},
    "/madrid/valoracion/": {"post_id":2636,"post_type":"page","slug":"valoracion","status":"publish","robots":{"index":true,"follow":true}},
    "/manchas-rojeces-fotorejuvenecimiento-ipl-madrid/": {"post_id":3375,"post_type":"page","slug":"manchas-rojeces-fotorejuvenecimiento-ipl-madrid","status":"publish","robots":{"index":true,"follow":true}},
    "/mas-informacion-sobre-las-cookies/": {"post_id":31,"post_type":"page","slug":"mas-informacion-sobre-las-cookies","status":"publish","robots":{"index":true,"follow":true}},
    "/matriz-diagnostico-facial-estructura-piel-musculo-grasa/": {"post_id":3334,"post_type":"post","slug":"matriz-diagnostico-facial-estructura-piel-musculo-grasa","status":"publish","robots":{"index":true,"follow":true},"schema":{"group":"blog","type":"none","context":"https://schema.org"}},
    "/medicina-estetica-chamberi/": {"post_id":1543,"post_type":"page","slug":"medicina-estetica-chamberi","status":"publish","robots":{"index":true,"follow":true}},
    "/medicina-estetica-laser/": {"post_id":1269,"post_type":"page","slug":"medicina-estetica-laser","status":"publish","robots":{"index":true,"follow":true}},
    "/medicina-estetica/": {"post_id":974,"post_type":"page","slug":"medicina-estetica","status":"publish","robots":{"index":true,"follow":true}},
    "/neuromoduladores-faciales-madrid/": {"post_id":3508,"post_type":"page","slug":"neuromoduladores-faciales-madrid","status":"publish","robots":{"index":true,"follow":true}},
    "/nosotros/": {"post_id":1656,"post_type":"page","slug":"nosotros","status":"publish","robots":{"index":true,"follow":true}},